{"$schema":"https://json-schema.org/draft/2020-12/schema","title":"External Estimate Result","type":"object","additionalProperties":false,"required":["snapshot_id","snapshot_hash","status","source_kind","provider","domain","period_start","period_end","as_of","metrics","errors","confidence","permitted_use","prohibited_use","revenue_verified","external_execution_authorized","external_actions","source_system_mutated","result_hash"],"properties":{"snapshot_id":{"type":["string","null"]},"snapshot_hash":{"type":"string"},"status":{"enum":["ESTIMATED_MARKET_SIGNAL","HOLD"]},"source_kind":{},"provider":{},"domain":{},"period_start":{},"period_end":{},"as_of":{},"metrics":{"type":"object"},"errors":{"type":"array"},"confidence":{"type":"string"},"permitted_use":{"type":"array"},"prohibited_use":{"type":"array"},"revenue_verified":{"const":false},"external_execution_authorized":{"const":false},"external_actions":{"type":"array","maxItems":0},"source_system_mutated":{"const":false},"result_hash":{"type":"string"}}}
